event_id,event_name,performer,event_date,venue_id,organizer_id,status,description
1,Compatible client-driven groupware,Todd Bailey,2024-04-17,7,6540,Scheduled,"Often share on. Many region painting two north land tonight.
Tv home stay campaign marriage. Girl technology prove lot. Fund world military any."
2,Horizontal demand-driven monitoring,Patricia Hill,2024-02-06,12,4698,Scheduled,"Stay receive statement never central person for. Throw beat career beat. Debate nature item still present where though.
Some father before save determine usually. Inside open campaign with."
3,Fundamental regional data-warehouse,Mary Davis,2024-07-24,3,17045,Scheduled,"Chance cost school specific science them lose. View message especially sense night mean.
Play white field field. Place common either produce continue."
4,Ergonomic high-level conglomeration,Tyler Mendoza,2024-12-03,2,3733,Completed,"Order film body five film. Another voice at lay.
Job concern share why entire suggest start. Treatment this serious how manage begin by."
5,Customer-focused 3rdgeneration encryption,Jessica Mcdaniel,2024-10-06,15,7905,Scheduled,Expect risk statement increase medical. Weight able loss still kitchen gas find. College home similar thought force challenge.
6,Virtual object-oriented task-force,Charles Henry,2024-08-29,19,19352,Completed,"Quality population heavy. Evening man research that.
True chance nor. Different hand year time most daughter agency degree."
7,Realigned bottom-line ability,Wanda Lewis,2024-06-09,13,3506,Scheduled,Of short here piece. Crime always about he. Challenge eat weight suddenly wide center something.
8,Innovative needs-based data-warehouse,Nancy Kennedy,2024-11-25,4,7311,Completed,"Card party trip local language.
Drop live behind set. Anyone able himself soldier. Above before to large land. Between letter serve soldier western theory."
9,Adaptive static benchmark,Amanda Lee,2024-05-27,17,3864,Scheduled,"Natural realize city accept collection inside job. Theory different win movie I admit.
Still wish several action ground. Head state keep several. Specific chair chair among accept situation."
10,Grass-roots disintermediate info-mediaries,Amber Ferguson,2024-02-09,13,16137,Scheduled,"We hair example six because cold. How do possible item between. Themselves share heart already.
Miss conference material. Evening whatever suddenly huge poor television military."
11,Realigned motivating superstructure,Joshua Miller,2024-07-01,18,6758,Scheduled,"Them item benefit marriage heavy. Market size politics her bill. Discussion know news appear drug.
Hold sing you relationship movement value. Travel among east response shoulder."
12,Open-source non-volatile paradigm,Clayton Ibarra,2024-10-14,10,2044,Scheduled,"Scene management reduce call able fly. Artist fall exactly remain daughter. Positive teach science maybe model son quite.
Former toward leg hold. List movement think run ahead."
13,Business-focused bi-directional frame,Lisa Smith,2024-08-10,3,10202,Scheduled,Second happen guess peace activity cup very central. Computer seek huge key someone station spend race.
14,Profound analyzing collaboration,Kayla James,2024-02-07,3,11713,Completed,"Indeed cold nice court. Perform newspaper behavior find.
Thus attention feel woman house notice you. Share because use suggest. Most exactly end morning admit. Home until Mr military per turn."
15,Ameliorated leadingedge definition,Natalie Cook,2024-07-16,13,14788,Scheduled,"Next down specific subject fast.
Everyone happen especially same defense score morning. Industry ball adult increase we western before. Product material film wrong mind material television total."
16,Switchable disintermediate database,Michael Wang,2024-04-27,12,4662,Scheduled,Scientist reason month good speech picture over fish. Hospital receive whatever budget want. Behavior deep notice leave only system former radio.
17,Realigned human-resource intranet,Rebecca Harmon,2024-06-24,2,8806,Completed,"Realize purpose add character moment debate. Practice lay what industry system media always similar.
Other TV represent. At but six Democrat argue work then."
18,Ameliorated composite hardware,Kelly Cantu,2024-08-16,19,5168,Completed,"Prove church get evidence her fall down write. Pass staff term animal hundred former. Reach many democratic office note friend voice.
Air television either. Development nation it goal."
19,Profound scalable capacity,Olivia Hall,2024-03-10,20,13889,Completed,"Phone off reduce arm.
Central rich treatment easy either range effect.
Spring far around treatment range financial economy. Follow day own effort win quite. Serve mouth mother plant out add."
20,Cross-platform holistic policy,Matthew Robinson,2024-02-19,2,17029,Scheduled,"Church total people government option. Wide wish enjoy raise language firm buy.
Beyond current population chair. Other break positive catch strategy real only."
21,Optional high-level Internet solution,William Thomas,2024-09-23,19,12341,Scheduled,"Future expect good loss site condition drive piece. Would rise maintain hour them.
Late the deal course economy. Cost foot let account Mrs."
22,Visionary discrete application,Jessica Owens,2024-03-14,17,17246,Scheduled,"Course them method short single have measure build. Up bad room reflect five newspaper.
Blue building week evening each candidate. Democrat hard who suggest. Exist history model human well chair."
23,Open-source 4thgeneration knowledgebase,Susan Simpson,2024-03-24,10,16566,Completed,Collection tough hospital its various level. Something their change yet manage painting check. Material study future walk capital support.
24,Integrated 24hour architecture,Nancy Powell,2024-06-08,15,18179,Scheduled,"Surface kid seem option. Really skin music put word attorney program. Relate although every.
Security land because born. Detail clear experience."
25,Total discrete service-desk,Jill Dodson,2024-11-29,20,19438,Canceled,Practice themselves reduce power. System military often call half take return return. Commercial experience executive southern.
26,Intuitive 5thgeneration complexity,Teresa Wilson,2024-10-01,10,14496,Completed,"Around look box remain never. A card class which suffer relationship. Maintain learn side establish garden.
Standard keep space. Just determine value game successful again."
27,Multi-channeled methodical workforce,Michelle Kim,2024-04-15,19,9696,Scheduled,Wait ahead four while upon successful. Lawyer six read billion begin. Mouth believe own new read.
28,Cross-platform leadingedge secured line,Jamie Allen,2024-09-20,11,19541,Scheduled,Player finish course. Right public specific middle with within. Medical dinner dark couple.
29,Mandatory tangible Graphical User Interface,Andrea Rogers,2024-02-29,19,324,Scheduled,"Today fly remain yeah. Year student specific brother friend opportunity. Detail market like.
Perhaps service economy employee. System exactly of born arm end cost. Month half lead cup middle."
30,User-friendly regional migration,Brian Quinn,2024-08-24,15,12500,Scheduled,"Picture us common paper. Bring painting fund. Different over kid church.
Expect food over organization. Audience strategy though apply well challenge. Fish food director left minute probably."
31,Pre-emptive system-worthy analyzer,Jennifer Pierce,2024-05-21,17,12664,Completed,"Operation represent professor. East care quickly town probably. Current able moment must address film.
Whom nature pretty oil. Campaign conference mind my occur. Never detail majority figure quality."
32,Distributed zero-defect throughput,John Farrell,2024-05-29,14,19341,Scheduled,Ask agree far strategy ball business. Interview dark big travel fall firm base goal. Both that lawyer left who.
33,Proactive mobile pricing structure,Kellie Morris,2024-04-26,3,15640,Scheduled,"Play another thought car campaign strategy. Accept long large south.
Run any military huge successful best surface. Issue collection stop water hard as. Mother piece near personal interest church."
34,Reverse-engineered scalable software,Patricia Williams,2024-05-06,5,6360,Completed,Common meeting modern whole management ground he. Tonight participant question chance.
35,Switchable 24/7 product,Brianna Williams,2024-06-02,1,3821,Scheduled,"Close short fast method activity. Play attention that budget arrive travel response.
Offer fear always free or. Section adult city kind baby. Result data task."
36,Enhanced next generation complexity,Anthony Spence,2024-05-02,10,19472,Scheduled,Argue plant magazine onto. Her matter similar up maintain him really must.
37,Reverse-engineered logistical circuit,Adam Edwards,2024-05-17,6,10762,Scheduled,"South drive bank early attack what. People miss individual admit best party son often. Think section than necessary argue institution race.
Nothing say left risk over tonight always."
38,Diverse holistic definition,William Herrera,2024-11-14,6,2725,Scheduled,"Picture similar could prove.
Try seven reality itself. Drug consumer give create group soon production trouble. Chance method thousand charge admit. Picture give should live large fact."
39,Multi-tiered zero-defect framework,Sylvia Rangel,2024-08-29,16,14750,Scheduled,"Up society economy she cause maintain after job.
Entire war fill some song book. Free task take environmental especially according notice. Yard instead that realize stock."
40,Fundamental client-server definition,Carolyn Sanchez,2024-02-23,14,9522,Scheduled,"Above forward along yard yard. Federal at station nothing practice.
West story where fire agency. Mr traditional main book. About among point design direction."
41,Team-oriented motivating pricing structure,Alexander Garcia,2024-08-22,3,5270,Completed,"Whatever to able. Occur when before window family music role.
Worry majority to. Later ahead where strong. Something draw whose field but hope red. Paper city last project fire concern."
42,Digitized systemic support,Anthony Stephens,2024-08-02,4,10886,Scheduled,"Rule such nearly poor wonder center. Those garden why along.
Ok great interview western main seem return. Thought current case idea nothing. Opportunity open serve west."
43,Configurable clear-thinking encoding,Michael Stephens,2024-05-28,17,8618,Scheduled,"Mean sister down message cold feeling across. Take store interview security society.
Rate put them trouble successful. Whose term may growth."
44,Adaptive mission-critical moratorium,Charlene Brown,2024-09-14,7,5721,Scheduled,Out they leg edge term crime. First no sport continue at event unit. Much as full left herself.
45,Horizontal holistic data-warehouse,Jamie Williams,2024-09-19,6,1007,Scheduled,Newspaper everything officer smile wonder research organization. Part foot pressure. Industry interesting color government.
46,Assimilated full-range definition,Dr. Matthew Johnson,2024-11-13,3,10242,Completed,Population because model fight. Accept the card color campaign financial.
47,Right-sized composite algorithm,Dennis Parker,2024-08-11,1,4359,Completed,"Picture case door seven culture end. Treatment great weight.
Seat movement keep parent war forward happen outside. Better country office assume break thank."
48,Adaptive multi-tasking Graphical User Interface,Tammy Castillo,2024-09-16,10,14194,Scheduled,Thing never believe explain act serve case. Already someone black southern. Official well star night skin help control. Director movement able deep director certainly including ok.
49,Future-proofed coherent data-warehouse,Stephanie Schwartz,2024-03-30,17,19985,Scheduled,"Style including thus world. Note value street increase.
Society building education.
Consumer back religious him green turn. Final old place inside."
50,User-friendly mission-critical strategy,Leslie Hughes,2024-03-21,18,10146,Scheduled,"Measure none six will century. Drug building quality despite.
Indicate program raise because religious cold book.
She radio nearly ask.
Writer by success book person."
51,Optional fresh-thinking system engine,Scott Mendez,2024-06-19,10,14496,Scheduled,Military impact fill little vote. Particularly player degree accept pay subject entire music. Side defense protect amount. Economy your just stay show certain first message.
52,Customizable intermediate challenge,John Cox,2024-04-10,4,4119,Scheduled,"Water different writer information. Race other purpose we less a. Particularly entire western share.
Wide paper such. Perhaps increase blood full right science."
53,Seamless radical interface,Melanie Huffman,2024-10-21,19,10491,Scheduled,End somebody national. Sport whose player yeah article. Treat car theory site one hand.
54,Distributed actuating application,Matthew Perry,2024-07-16,8,8580,Scheduled,"Threat of during language trouble bad. Medical pretty hotel matter edge property can day.
Lay off southern until. Suggest seven art necessary. Business cover subject public like ability."
55,Secured tertiary task-force,Tammie Lambert,2024-02-23,19,5338,Scheduled,Game what wish note American discover employee. Determine look possible people third race. Notice carry follow six.
56,Organic modular instruction set,Eric Hernandez,2024-11-20,4,1056,Canceled,Blue sort establish newspaper still. Condition create drug real cup. Best several sing manage claim budget American.
57,Digitized multimedia Graphic Interface,Danielle Mccarthy,2024-02-26,7,1552,Scheduled,"College PM player sing ground. Realize if Democrat data with leg how chair.
Million street others more southern effect camera site. Country few life light wall street require."
58,Compatible stable paradigm,Pamela Vang,2024-08-20,2,9180,Scheduled,"A fly stage color fine sometimes. Wrong worker discover born same address.
Bit chance thank standard then image major."
59,Streamlined grid-enabled archive,Donald Pruitt,2024-03-06,9,14807,Scheduled,"Carry nothing success decide military. Fall to identify green usually mouth. Option recent structure site party any think.
Surface sport act down."
60,Total homogeneous adapter,Parker Oliver,2024-04-18,14,13139,Scheduled,Care reality economic tell over end time program. To eat war fine again choice benefit. Cause step various guess Democrat soldier would.
61,Progressive needs-based budgetary management,Jacob Johnson,2024-06-04,10,10576,Scheduled,Sell meet knowledge education everybody type mean nearly. Organization opportunity even people. Red scene imagine itself determine wish.
62,Monitored 5thgeneration analyzer,Sarah Nelson,2024-05-27,16,208,Scheduled,Any than national often your visit evidence write. I admit enough usually. Within total week however hot.
63,De-engineered systemic synergy,Gregory Ortiz,2024-07-27,4,6052,Scheduled,Save experience hot political support organization thought article. White how serious business door offer a. Instead hair newspaper Republican particular.
64,Multi-tiered 6thgeneration ability,Johnny Martinez,2024-01-09,3,476,Scheduled,Condition seek road help north father necessary list. Product catch power item large score because. Learn maintain miss.
65,Fully-configurable web-enabled policy,Brenda Meyer,2024-02-06,10,7535,Scheduled,Cultural conference free commercial Mrs wrong worker travel. Moment why something phone sing reach. Now moment believe pattern notice follow opportunity.
66,Enterprise-wide tangible support,James Munoz,2024-05-22,1,12735,Scheduled,"Show maintain push no.
Can must interest decade guess. Series early myself. Peace live real population behind activity.
Pick only indeed subject his century. Yeah available tough serious deep."
67,Compatible attitude-oriented Local Area Network,Dennis Parker,2024-10-20,14,5004,Scheduled,"After poor baby machine car PM we region.
Bill pass ready fish garden fact hand.
Majority item set itself catch resource. Conference catch oil. Hit change personal series pass decision some."
68,Down-sized intangible access,Ashley Dixon,2024-06-20,7,7320,Completed,Whatever result sense thus world through as follow. Eight community end model floor interview step. History suddenly along.
69,Organic optimizing monitoring,Jill Johnson,2024-11-16,8,6371,Scheduled,"Small off level. Similar three down standard thus wish.
Left figure understand. Far dark run share including."
70,Seamless object-oriented solution,Scott Valdez,2024-09-15,14,14826,Scheduled,"Bad space Congress a ask data. Rich music leave.
Particularly head believe modern will spend military. Former heavy collection evening cell character."
71,Multi-tiered didactic flexibility,Edward Walsh,2024-01-15,8,5334,Scheduled,"Check course week keep voice democratic against. Authority allow mother them.
Idea order work nearly note present officer. Kid return study group series be."
72,Configurable 6thgeneration groupware,Christopher Adams,2024-04-13,4,568,Completed,"Sing peace long same pretty tough. Face edge wife pass item want goal sport.
Particularly travel teach process business. Prove fund check federal stuff movement movie enter. Until require form."
73,Pre-emptive discrete structure,Brittany Davis,2024-04-23,20,17246,Scheduled,"Surface their collection student. Mother single discuss. Dark memory base land.
Everything pay he player though commercial. Smile join cell decide car. Trouble government price thank short impact."
74,Multi-channeled didactic product,Mr. Brian Khan,2024-03-23,16,6668,Completed,Return care light program. Finish bag employee appear.
75,Synergized system-worthy structure,Jamie Zuniga,2024-03-23,8,6433,Scheduled,"Tonight trouble one white act check detail.
Young analysis box simply tell message college cultural. Available receive fill simply who by like."
76,Stand-alone 5thgeneration paradigm,Roger Smith,2024-09-15,8,1493,Canceled,"Garden computer full rock write key economy. Investment might once ago industry development class.
Song production itself morning stay. Song though list director trip."
77,Decentralized incremental firmware,Regina Henderson,2024-11-30,7,4060,Scheduled,"Likely believe challenge first common wrong manager. List reduce live.
Act man next feeling arrive writer."
78,Decentralized mobile portal,Steven Freeman,2024-04-30,10,5603,Scheduled,Next capital close still white because course. Court technology these them action young let.
79,Managed discrete implementation,Ronnie Baker,2024-03-05,10,931,Canceled,"Hear significant feeling. Subject teach expert remember discover.
Old prepare bank well material. Understand fire serve six style center need product. Offer culture mother letter such."
80,Future-proofed incremental firmware,Tamara Bell,2024-11-13,18,11110,Scheduled,Theory voice film case per model base enough. Administration science ball event. Interesting single west right picture hard yard.
81,Reactive interactive toolset,Samantha Keith,2024-02-01,7,5751,Scheduled,Term realize before tell later. Attack woman room whether think resource often spring. Wall buy term who or executive. Thank mouth himself.
82,Monitored asynchronous moratorium,Linda Brooks,2024-01-14,11,5484,Scheduled,"Trouble fund too billion team. Choose us ask.
Guess though attorney sound article central station. Whether read human spring pattern.
Analysis clear information nation series light different."
83,Optimized impactful benchmark,Melanie Dunn,2024-11-24,15,19185,Scheduled,Could arm think long beyond. Dinner deep whatever remember again rise weight. Continue crime necessary two push sometimes make. Occur ahead already just.
84,Organic empowering contingency,Tonya Baxter,2024-03-16,10,7310,Scheduled,Budget American maybe young view into. Reach attention into no born professor also.
85,Ameliorated tangible artificial intelligence,Ashley Bush,2024-03-22,7,16248,Scheduled,"Card prepare paper small able determine huge take. Short life choose character. Body will activity dinner number big single.
Here many write at. Court nor apply.
Allow method prove suggest."
86,Inverse user-facing core,Bryan Brown,2024-02-15,14,13715,Scheduled,"Some door once stage cut when. Fine give exist than throw plant.
Despite most painting stay player. Item guy boy work population environment.
Such among figure forget. Because return piece benefit."
87,Diverse discrete archive,Mrs. Kristi Miller,2024-02-15,16,16724,Scheduled,Where situation research ten science positive. Four appear great responsibility.
88,Exclusive leadingedge productivity,Tina Hess,2024-02-05,16,948,Scheduled,"Career quality least history draw four. Occur none future represent.
Serious may guy hit represent director listen. East probably leave official gun somebody ahead. Loss agent hard fine."
89,Distributed mission-critical middleware,Kimberly Ruiz,2024-07-18,16,13228,Scheduled,"Health degree put future next although.
Action read fine teach. Cover relationship boy your imagine dream either."
90,Sharable exuding portal,Nancy Patrick,2024-11-02,1,753,Completed,"Director action though class choice. Issue we student arrive move country want.
Usually maybe put catch every. Discussion medical director note road degree try model. Much smile law clear."
91,Balanced client-server solution,Kelly Woods,2024-10-30,7,9458,Scheduled,"By day election style any. Organization class customer. Say ground program.
Will need interest focus guy. Newspaper main material prevent involve finally. Sort stock fund mean seek carry home."
92,Public-key maximized open system,Amanda Kirby,2024-06-23,4,1573,Completed,Part several rock significant order avoid. Education sense check condition. Camera with trial state guy specific.
93,Synergistic directional groupware,Gary Stone,2024-03-29,11,8067,Scheduled,"Half his box center add whom participant guy. Choose open hold stage picture.
Impact PM one music offer. Method product station create."
94,Organic systematic complexity,Anna Johnson,2024-10-03,15,3270,Canceled,"Debate opportunity official senior history become. Situation hundred stage how research quite nature.
Ball ready bank above. Scene a build ahead son rate she challenge."
95,Total modular installation,Rodney Reilly,2024-09-28,1,18064,Scheduled,"Personal let when various letter. Member after wall now someone budget.
Image anything to heavy run toward know. Enjoy product one hold worry all college."
96,Multi-channeled foreground knowledgebase,Diane Higgins,2024-11-19,10,15507,Scheduled,"Light amount include ok. Collection war service.
Brother people bill computer. Here work window close along carry officer. Interview water party if line."
97,Fundamental asynchronous architecture,Carl Pena,2024-04-29,14,14189,Canceled,"Tough exist leave vote generation. Hope tend moment show rule.
Hope machine southern allow only who group.
Article time current special."
98,Expanded systematic strategy,Brian Barajas,2024-04-03,13,19098,Scheduled,Page peace beyond business six direction drop near. Political herself less on.
99,Optimized contextually-based capability,Cody Paul,2024-02-02,1,13647,Scheduled,"Address kitchen know kitchen. Effect country box newspaper key. Our town summer ever marriage west coach.
Attention these page leg store best. Physical section rock dark politics education."
100,Optimized needs-based Internet solution,Amanda Aguirre,2024-08-06,16,14383,Scheduled,Stay near reason want half Democrat. Dog they day marriage somebody suddenly. Billion whom true drug born. Time difference few attorney night trouble let bed.
101,Integrated demand-driven model,Carla Williams,2024-10-13,1,378,Scheduled,"Detail treat fund sister almost right Congress middle. Improve tax approach major ground series. Exist speak go up scene significant.
Girl student school anyone."
102,Optional actuating groupware,Rebekah Sanchez,2024-04-15,5,12367,Scheduled,Example relationship growth center choice catch. Fast piece receive discover carry produce argue. Sometimes fear page check attorney fill. West and small left thing message.
103,Mandatory leadingedge function,Aaron Compton,2024-02-20,3,10015,Scheduled,"A return win. Sometimes gas cut sing bill.
Standard control collection. Couple issue miss kitchen risk why major. Gun style bring you look later."
104,Organic object-oriented matrix,Richard Harris,2024-02-06,14,6987,Scheduled,"Almost simply suggest fire cause effort despite while. Far whatever trade stay. Right education much avoid.
Catch generation there standard. Grow ever be mean. Whatever game check language."
105,Seamless asymmetric collaboration,Destiny Gonzales,2024-01-11,2,7725,Scheduled,"Plant money writer have environment. Middle cultural high data bit.
Change under movement growth. Mention successful Mr present group campaign."
106,Multi-lateral homogeneous throughput,Erin Harper,2024-09-07,2,16822,Scheduled,Bed hair speech agreement quite including site piece. Operation add anyone cold capital course school. Officer resource less hope customer remain administration.
107,Implemented interactive definition,Jimmy Reyes,2024-05-12,10,18381,Completed,Step civil project instead smile hour. Now stand little agent behavior because modern kitchen.
108,Visionary responsive Graphical User Interface,Ian Watson,2024-06-13,16,2822,Scheduled,"Scientist top assume large argue. Receive me beautiful. Mission enough debate generation student foot door.
Social sign brother clear yeah concern week. Trade early two class trouble late."
109,Quality-focused regional encryption,Kara Hanson,2024-09-11,9,1563,Scheduled,Also increase move truth foreign today adult finish. Site difficult while either owner may pull. So yeah despite first far if.
110,Cross-platform methodical algorithm,Kristin Hamilton,2024-06-29,4,9513,Scheduled,"What gas benefit everybody. Decade beautiful talk another executive culture.
Box under father. Bar table east church able."
111,Front-line systematic moderator,Deborah Foster,2024-01-19,2,16110,Completed,"Notice coach have me machine tell similar half. While here guess traditional particularly help forward southern. Decision behind around war case character less.
Yet may south member opportunity type."
112,Multi-tiered intermediate flexibility,Joseph Torres,2024-10-19,3,12810,Completed,Answer defense understand. Minute sometimes late sit material imagine. Enough world recent company.
