event_id,event_name,performer,event_date,venue_id,organizer_id,status,description
113,Switchable stable array,Brittany Morgan,2024-09-25,17,1154,Scheduled,Executive support along draw reflect nice seven. Individual race interest local security. Least choice mission nearly reality born. While during attorney medical decision win authority.
114,Public-key full-range system engine,Gary Parker,2024-01-07,14,6804,Canceled,Wonder American party anyone how. Appear director significant along. Night somebody present about kitchen summer city. Fund wide hot true begin.
115,Robust modular help-desk,Brittany Smith,2024-04-30,12,3823,Completed,"Game plant each sell. Tree popular when. Boy church capital would east.
Recent win task soldier bar strong fire. Point machine total born. Race treatment resource number."
116,Centralized 6thgeneration frame,Kristy Morton,2024-10-20,15,4481,Scheduled,Send television oil will defense. Goal sometimes catch after leader dark card. Door others economy institution.
117,Assimilated full-range system engine,Randy Martinez,2024-08-25,9,3044,Scheduled,"Level customer raise tree election others. Return seat back blue. Small total least some many performance their.
Resource baby social particular hit war according. Cultural and company final."
118,Robust mobile capability,Jorge Serrano,2024-01-05,15,9429,Scheduled,Free door citizen even seek learn. Although serious thousand skin accept.
119,Upgradable human-resource initiative,Aaron Maldonado,2024-05-16,4,6702,Completed,"Fine peace friend author personal. Tv write gas heart compare whom. Can day easy hand no health so develop.
Hundred foot outside method close listen painting. Yet decide serious former day attorney."
120,Fundamental client-driven instruction set,Julie Price,2024-10-02,18,4777,Completed,Than first yes. People loss thousand little weight report. Home our capital. Whatever catch give war executive raise professional.
121,Enhanced optimal task-force,Teresa Cummings,2024-05-07,6,5109,Completed,College matter heavy difficult catch owner boy. Several pattern almost responsibility effect network. Worry star letter seek add.
122,Inverse 6thgeneration throughput,Robert Silva,2024-03-04,3,1032,Scheduled,"Discover let culture task others identify activity. Me often meeting building conference. Player over individual.
Local notice music. Me if suggest couple pressure."
123,Progressive logistical matrices,Aimee Rogers,2024-11-16,17,11070,Completed,"Tend effect quality themselves south person concern. Win let imagine ready.
Church teacher class hope unit. Act decade radio seem cold oil politics. Race speech risk including."
124,Diverse foreground open system,Virginia Taylor,2024-04-04,3,17319,Canceled,"Strong everyone eat its believe half respond. Yeah yourself question behavior.
Center though television turn reflect. Rich to owner factor lawyer chance. Mrs your national more."
125,Synchronized high-level project,Sheila Flores,2024-03-19,15,5168,Scheduled,Unit campaign president peace front trip. Then class western similar phone camera imagine. Enough cause find positive site.
126,Persistent motivating secured line,Cynthia Lopez,2024-07-06,16,11840,Completed,Just end enjoy begin door for law you. Old so pass.
127,Fully-configurable 4thgeneration neural-net,Joseph Schneider,2024-04-24,19,4857,Scheduled,"Can go story red guy attention. Future sometimes study small us decade decide.
Bed above action boy major last fight. Research rate thought story fill type we. Significant act official name."
128,Profound actuating adapter,Richard Jennings,2024-11-06,19,2782,Scheduled,"Exist high describe share field. Everything stage beat watch message.
Point common physical employee dinner yes see here. Career concern likely happy five performance."
129,Reverse-engineered client-driven groupware,Michael Horn,2024-10-11,9,6990,Completed,"Carry reach ready occur ball east. Their executive price skill leader level. Fast note impact often run market.
Box woman may which. Should share some picture. Both thus accept daughter effect."
130,Switchable multi-state forecast,Andrew Clayton,2024-08-24,10,3294,Canceled,"More democratic produce respond. Day crime easy play. Field director show contain.
Now mission almost ready traditional suggest argue. What need reveal step."
131,Future-proofed eco-centric parallelism,Danielle Park,2024-11-06,4,5048,Scheduled,"These tonight run. Up feel full skin tend.
Left down special reflect song value. Else point Republican participant."
132,Multi-tiered needs-based access,Justin Collins MD,2024-01-24,16,4556,Scheduled,Any current stop. Wait prepare can others surface. Foot the ball month spend cold girl.
133,Multi-lateral contextually-based analyzer,Ronnie Cunningham,2024-02-24,1,5905,Scheduled,"Treat industry itself final price keep political. Phone receive social which. Author production late.
Around hotel fight social. Career control smile plant. Believe after end set around party water."
134,Digitized exuding artificial intelligence,Melody Gibson,2024-08-09,4,5457,Scheduled,Accept thing his worker herself friend consumer. Positive church particularly response return race. Down result admit who upon require.
135,Streamlined real-time Graphical User Interface,Angela Frazier,2024-04-09,20,12422,Completed,Economic because suddenly prevent economic indicate. Speak reflect soon item plant. Game use fish election fear. Avoid road cultural end.
136,Multi-lateral leadingedge framework,William Jackson,2024-04-11,4,1552,Scheduled,Cultural other structure stage tax senior alone. News head hair. Charge public medical test Mr.
137,User-friendly secondary task-force,Tim Thomas,2024-09-04,15,10259,Completed,"So up image picture. Sing arm political detail best take. Performance every despite down sound play practice.
Central alone music get. Someone other bank. Girl into father dark ability detail."
138,Open-architected grid-enabled Graphic Interface,Betty Armstrong,2024-09-30,5,5422,Scheduled,"Record pull garden mind thought. Couple catch many air near five.
Fish leader member walk show president. Onto argue land itself."
139,Mandatory 24/7 core,Aaron Cochran,2024-01-09,17,11465,Scheduled,"International always travel big build boy. Fight herself situation.
Try push blue return history four."
140,Grass-roots bifurcated info-mediaries,Jermaine Williamson,2024-08-06,11,10582,Completed,"Program central card early. Right speech east chance where hundred win.
Speech girl behavior him country thousand. Plant within mother sign tell. Peace day child standard go whether sing."
141,Compatible well-modulated workforce,Christopher Finley,2024-11-09,7,12623,Scheduled,"Last to follow kid effect parent attorney. Value side card employee evening.
Instead live special similar. Young industry TV health cup top threat fill. Region measure on help."
142,Open-architected background neural-net,Chad Elliott,2024-05-18,4,12520,Scheduled,"In determine hand image factor throw rise. Administration either according. Effect any billion.
Boy phone window himself person. Despite structure well. Pressure probably company former could stay."
143,De-engineered mobile hardware,Jonathan Miller,2024-06-03,6,15648,Scheduled,Do beat list including reduce week. Question task stuff all direction look character.
144,Progressive web-enabled toolset,Linda Welch,2024-04-25,2,18527,Scheduled,"School power animal claim. Serve key news early.
Term very stage both thing concern. Commercial simply machine face billion follow. Represent piece single this smile few popular."
145,Fully-configurable contextually-based challenge,Timothy Hoffman,2024-03-08,1,15358,Scheduled,"Certainly friend husband foot. Area sing create response born news even.
Food government politics doctor. Especially stock indeed senior."
146,Synergized background implementation,David Bartlett,2024-11-21,7,12253,Scheduled,Technology discussion age research score main. Identify without rest thousand budget yourself no. Drop order black arrive enter top.
147,Optimized 4thgeneration open system,Chelsey Foster,2024-05-09,10,4692,Scheduled,"Both hospital guess election affect occur admit. Will without dinner here. Claim south week new movie late.
Speak hundred cost others yes. Myself group science drive author."
148,Total zero administration data-warehouse,Philip Hanna,2024-08-24,4,12280,Scheduled,"Letter model positive teacher any most cup where. Rock expert very.
Message sing occur she. Late poor fine vote official. Arrive simple actually hand."
149,Profit-focused holistic architecture,Zachary Rios,2024-07-04,11,11586,Completed,"Former idea thank structure put. Over success give in television. Yet challenge main central reflect next.
Thus significant scientist onto become. Music could pay decide black."
150,Universal neutral challenge,Jamie Kelly,2024-08-12,17,5098,Scheduled,Must reflect author physical hospital choice a fall. Successful offer respond risk middle.
151,Decentralized hybrid standardization,Mitchell Rice,2024-08-07,11,12920,Scheduled,Grow air team house. Forward society day her myself stage sense. Along buy baby hot.
152,Diverse neutral flexibility,Matthew Meyer,2024-09-05,5,11097,Scheduled,Here she ask son hot leader view. Main ability travel five almost mission design pull.
153,Profound actuating implementation,Hannah Brown,2024-04-26,16,3464,Scheduled,Only really back artist particularly describe. Become receive machine more government church. Season indicate change oil president.
154,Multi-channeled homogeneous neural-net,Angela Valdez,2024-05-11,9,10971,Scheduled,"Age several single economy. Develop ask but take measure cup each ground.
Bring cultural quickly trip between conference bill. National part what."
155,Proactive bottom-line solution,Brenda Doyle,2024-11-20,8,14208,Scheduled,Need police shake machine. Save around sort notice rise certainly. Memory network brother. Leave visit cup.
156,Self-enabling analyzing toolset,Douglas Ross,2024-04-12,7,12730,Scheduled,"Economic various network month or.
Tax station kitchen summer himself. Travel toward thus they decide peace job. Even case game significant daughter. Cell term third bring prove."
157,Organized multi-tasking framework,Robert Long,2024-10-12,14,9826,Completed,"Million above part model choose or. Father certainly within church fund little little seven.
Use sister green decision power need next. Include life form get number name."
158,Balanced full-range attitude,Robert Stanley,2024-06-23,13,4792,Scheduled,"Keep others hold real hit assume have.
Truth single itself heavy remain interview them. Environment beautiful forget social establish.
Thus must be medical."
159,Digitized mobile contingency,Robert Mann,2024-06-25,1,6698,Scheduled,Ground everyone fight clearly structure star. Dog talk artist serious paper budget cover. Easy miss imagine within.
160,Quality-focused bandwidth-monitored knowledgebase,Kathryn Wilson,2024-03-01,13,18103,Completed,Four material candidate north economy always hand. Wear dog election your so.
161,Implemented reciprocal moratorium,Benjamin Gutierrez,2024-03-31,14,18355,Canceled,"Sea series degree thank short. Free seem relationship strong space dark state.
Go play change present structure mention evidence brother."
162,Re-engineered eco-centric analyzer,Jeremy Jacobs,2024-04-23,6,17596,Canceled,"Sit person may let. Bill clear trade character population.
Television six red say. Several result idea."
163,Ergonomic directional budgetary management,Samantha Flores,2024-05-20,17,14280,Scheduled,"Itself air over himself. Million mention draw against hear. Should study benefit indeed walk movement its.
Early themselves modern red. Drop cell have."
164,Persevering clear-thinking emulation,James Villanueva,2024-04-24,17,18361,Scheduled,"Seek happy in air his.
Tv generation white white happen. Just land body tonight set outside.
Against check accept fill position. Stuff fish surface training present check."
165,Operative intangible encoding,Erin Bailey,2024-02-08,17,3221,Scheduled,Foot well charge his third represent include. Test show risk those war anything.
166,Universal 3rdgeneration algorithm,Ariel Farmer,2024-06-14,19,17140,Scheduled,Western main member. Action ask adult wrong suffer type. Hotel hope door. Beyond start account computer seek product.
167,Enterprise-wide static capacity,Matthew Turner,2024-01-25,18,7103,Scheduled,"Their several matter let think research. Either more mission.
Listen court traditional list share involve. Ground respond over call cultural between tell. Now anything major."
168,Synchronized radical throughput,Anthony Baker,2024-04-04,15,14284,Scheduled,"Whole process picture technology deal carry west. Memory indeed culture dark whole base happy.
Whether of right north. Drug kitchen push phone. Yes live big. Our local too however."
169,Distributed homogeneous collaboration,David Hill,2024-08-18,20,18154,Canceled,"Peace tax country check debate person TV. List whole type bill budget stop own seven.
North expect nice alone establish pass. Throughout well close dog. Man fall recent enough."
170,Profit-focused hybrid artificial intelligence,James Cantrell,2024-01-18,19,6612,Completed,High network turn Mrs book serve. Plant sort ever low all group tough. Mrs population most along mission.
171,Monitored coherent complexity,Cassandra Wood,2024-01-22,20,10732,Canceled,"Exactly scientist cut here gas determine crime.
Public executive claim live impact smile. Race ability green husband. Smile from onto consumer just can girl."
172,Expanded holistic initiative,Kevin Moore,2024-06-24,17,12306,Canceled,"Price future exactly artist on. Expect enough yes. Option indicate seem his out party.
Responsibility good police suffer best value many time. Participant finally responsibility those letter space."
173,Vision-oriented foreground matrix,Heather Brown,2024-11-12,9,11464,Scheduled,"Whose ability dog parent drop. Expect training commercial rest military notice. Blue town media fly leader evidence.
Quality very machine door leg citizen. Century know continue staff."
174,Switchable client-driven capability,Marissa Williams,2024-11-22,9,8127,Completed,"Guess expect actually pay. Skill from black at him rise. Ahead trade impact.
Outside point before within inside. Suffer trial know international bring film rather. Important capital media."
175,Innovative reciprocal conglomeration,David Banks,2024-05-28,6,18549,Scheduled,Born address soon agent daughter their save budget. Subject seem begin last open board democratic air. Receive down personal talk.
176,Persistent radical alliance,Charles Johnson,2024-07-19,4,1672,Scheduled,"Practice fish someone according. Turn four land employee. Item religious name.
Station money ahead his ball. Future each occur cell whether why speech probably."
177,Cloned secondary moratorium,Aaron Jackson,2024-08-21,7,1271,Completed,"Receive detail direction career.
Feel road long image service resource know customer. Pay garden course mean wide pattern turn. List can season wife budget. Such opportunity even war somebody high."
178,Right-sized background structure,Elizabeth Daniel,2024-07-17,3,9672,Scheduled,"Take everything population again exactly age. Study couple yourself million staff him.
Floor international network view police. Throw nice role there relationship nor."
179,Multi-channeled reciprocal extranet,Thomas Abbott,2024-03-10,7,6371,Scheduled,Stay play on around compare hotel. Seat bag buy weight nothing. Movie concern feel push the.
180,Visionary exuding model,Gail George,2024-07-24,20,16513,Completed,"During late watch statement commercial finally where. Business college structure hospital.
Attention make conference cover read.
Far focus choose adult young. How per why different state."
181,Devolved explicit standardization,Jasmine Lopez,2024-03-28,9,11670,Scheduled,"Production marriage series perhaps network.
Reduce main stuff serve sport ten accept. Control defense note car ahead key wrong. Involve place population meet."
182,Exclusive intermediate workforce,Laura Adams,2024-07-15,1,13171,Canceled,Key center for peace method notice. Be me image good meet responsibility. Effect husband indicate fear use lot.
183,Quality-focused fresh-thinking emulation,Katie Wade,2024-04-06,4,6116,Scheduled,"End moment suddenly account name career. Draw whose walk science.
Magazine kitchen Mr generation worker. Offer structure ok contain resource media. Involve hair may analysis fight one certainly."
184,Adaptive methodical toolset,Christopher Garcia,2024-01-05,4,14853,Scheduled,Allow positive sea which state machine result girl. Mean language dog perhaps event series Republican team.
185,Configurable dedicated framework,Angela Shaw,2024-03-14,14,12174,Completed,Owner result example seven but whose nature. To relate believe. Through play cost sense ok act watch.
186,Function-based national process improvement,Thomas Smith,2024-02-25,1,3792,Scheduled,Make prepare me note beat take last. Hospital economic career already seem cover office without.
187,Up-sized multimedia challenge,Rhonda Peterson,2024-01-16,2,14468,Scheduled,"Price already report picture head ago. Catch wonder training general office easy area.
Analysis man arm new recently food. Look shake center power. Serve whether cup wife spend help family."
188,Integrated well-modulated orchestration,Richard Alvarado,2024-02-15,4,13011,Scheduled,"Rich question kitchen. Explain when by leg manager us operation black.
Attorney six above late top arrive.
Condition test there. Sort police fine treatment stuff country. Get they certain find."
189,Horizontal multi-tasking functionalities,Mary Anderson,2024-07-29,2,4372,Scheduled,"Improve generation east we since. Kind up example want on. None attorney let home.
Painting must analysis research movie good.
Change black score side card. Music term affect question."
190,Operative object-oriented structure,Michael Morton,2024-09-26,7,7103,Canceled,Answer future attack above travel art seem. Share soldier whole far alone risk. Company bed who relationship production outside.
191,Mandatory contextually-based functionalities,Jason King,2024-09-02,10,9663,Completed,Man middle power standard suddenly main action simple. Media free at east discuss recently. While voice institution threat.
192,Polarized dynamic methodology,Elizabeth Smith,2024-02-11,5,10853,Scheduled,"Attorney south not color. Lay exactly past safe myself hit. End follow skill leg before.
Something development require receive we administration season. Film face my agency country focus democratic."
193,Business-focused fresh-thinking migration,Riley Shaw,2024-03-20,4,16281,Canceled,"Summer serious behavior source accept. Where direction report police exactly few. According never Congress population he.
Nature strong often you."
194,Right-sized demand-driven challenge,Peter Harris,2024-11-07,20,6875,Scheduled,"However Democrat name.
Quickly green share catch. Anything expert white way operation century end whatever.
Technology technology information song. Seven make low win middle high use task."
195,Advanced solution-oriented website,Joshua Buckley,2024-03-14,1,12546,Scheduled,"Common smile child build. Theory five police financial plan.
Peace federal film particular though rate. Husband concern local exist environment establish. Skill young take evening chance front."
196,Fundamental modular frame,Michelle Wells,2024-10-20,4,6228,Canceled,"Case effort cell treatment approach lose. Dinner opportunity when prevent total.
Since best law big beautiful thought drug. Six yourself sort woman. New laugh agency put yourself leg report."
197,Centralized multi-tasking groupware,Robert Fox,2024-09-12,8,8312,Canceled,Charge life table contain simple more. Entire strong give foot product director pressure. Add thousand four forget no.
198,Ameliorated local application,Christopher Medina,2024-03-22,13,4669,Scheduled,Difficult population personal news land. Bring painting project large mind. Fast second allow rate clearly individual attorney.
199,Automated eco-centric access,Tracy Harvey,2024-07-15,9,11020,Scheduled,"Character spring become.
Author research opportunity hotel car certainly message. Statement term safe itself imagine value agent. Usually continue guy power decide physical."
200,Profound client-server budgetary management,Dennis Bennett,2024-08-27,19,14747,Scheduled,Last opportunity live early ground. Likely result public will.
201,Fully-configurable regional moderator,Jonathan Myers Jr.,2024-01-28,15,12520,Completed,Letter know year near set raise down. Party collection image reflect traditional anything final recent. Base bad include local despite bank. Treatment visit magazine realize.
202,Universal exuding adapter,Mark Ramirez,2024-03-24,9,19210,Completed,"Itself chance size hold. Inside student drive well no conference growth.
Create industry operation happen practice behind. Campaign financial single heart woman prepare mention."
203,Networked methodical time-frame,Amber Sullivan,2024-07-25,19,9331,Scheduled,"Enjoy hot baby can. Miss political laugh director.
How half weight family million. Fly same close human goal lot."
204,Stand-alone needs-based standardization,Gregory Crawford,2024-03-30,20,14231,Completed,Face more wrong adult feel you. Skin strong government two cut. Affect debate white early them face stop.
205,Triple-buffered modular artificial intelligence,Todd Butler,2024-07-18,1,5488,Scheduled,End onto order note social sport. Ten in enter. Item long her return suddenly ground center outside. Amount agent economic.
206,Future-proofed needs-based middleware,Shannon Mckinney,2024-08-06,4,17430,Completed,"Enter next along interest billion. Through return natural wind our.
Administration rule hotel clear bed. Level ground else authority."
207,Profound incremental function,Billy Scott,2024-11-13,14,4430,Scheduled,"Clear quickly yard. Drive because family sit stay get here.
End side voice your area bit north stop. Evidence perform break it beautiful fill reason. Chair day institution but somebody parent."
208,Polarized dedicated encoding,Anthony Levy,2024-08-13,2,270,Scheduled,"Decide billion building form. Note about least street. Top life everyone work.
Suggest trip push mouth affect design real."
209,Multi-layered scalable conglomeration,Mrs. Stephanie Ochoa,2024-07-20,7,16724,Canceled,"Two drive beyond set kid miss.
Whole be receive picture expert start large. Child charge TV. Mouth suffer painting me. Rock area nor place imagine."
210,Sharable value-added customer loyalty,Elizabeth Kelley,2024-11-14,5,11199,Scheduled,Blue short until time among. Worry anyone lay question and throw include.
211,Cross-group bottom-line access,Jared Calderon,2024-01-08,12,334,Scheduled,Third this exactly now end. Marriage expert serious notice find example. Agency young stay sure kind deal.
212,Exclusive disintermediate projection,Kimberly Mahoney,2024-01-24,12,2207,Completed,Night send possible daughter wonder eight. Surface determine lawyer more who enjoy statement share. Trade response every change scientist.
213,Fully-configurable clear-thinking task-force,Calvin Cochran,2024-02-05,18,405,Scheduled,"Call particular sing walk chance note. Issue radio big type model. May firm let wish.
Late education society budget. Bad let low realize conference."
214,Customer-focused context-sensitive emulation,Danny Thornton,2024-09-05,12,16109,Completed,Attorney number gas send piece. Sea guess challenge watch girl final. Table top election interview.
215,Synchronized modular hardware,Sean Leonard,2024-11-10,2,14031,Scheduled,Office loss color hospital write stage. Move left information medical decade must.
216,Business-focused coherent task-force,Patricia Macdonald,2024-09-15,4,15489,Scheduled,Everything happy fall allow still. Tree opportunity such here test structure at. During where now participant. Fight hit after ahead ready.
217,Automated even-keeled superstructure,Katie Miller,2024-08-01,14,10572,Scheduled,Industry name pass in go including stage. Assume central break civil size term. Able body wall usually pull set eight.
218,Stand-alone bifurcated projection,Scott Elliott,2024-05-18,1,6087,Scheduled,"Doctor throughout thus meeting anyone pay high herself.
Pattern office design kitchen break style. Policy tell test marriage."
219,Self-enabling methodical project,Pamela Ritter,2024-11-27,3,18697,Completed,"Inside trip statement.
But history choose heavy. Set business fast financial mission top fast six.
Put however never stop. Stock program people check teacher whether."
220,Configurable mission-critical architecture,Adam Beard,2024-09-06,16,175,Scheduled,"Ten office in not.
Power go father effort. Interest case choice agent law themselves. Or report nearly fish price data."
221,Future-proofed real-time projection,Christopher Ramsey,2024-09-04,1,16643,Completed,Attack war cost back some approach politics. Leave still serious want involve feel phone center.
222,Managed discrete instruction set,Danielle Dalton,2024-11-15,14,5567,Scheduled,"Guy back physical minute. Color service understand consider within. Together rich trade hand wear recent staff high.
Thank tax his book the argue. Very condition possible administration hard which."
223,Streamlined disintermediate portal,Laura Phillips,2024-02-04,17,19156,Completed,"Decision spring several allow. Successful tree see. Season reduce point on.
In threat court eat under stop drop. Country through ten choose some."
224,Sharable multimedia hardware,Whitney Andrews,2024-06-12,20,11184,Scheduled,"Turn add concern eat account. Direction through hospital practice couple kind.
Raise game blood by. Important require success set southern improve purpose."
225,Managed eco-centric budgetary management,Jacqueline Anderson,2024-01-13,17,18347,Completed,"Color especially door how couple what view full. Tell realize floor commercial. College beat kind different difference body station number.
Quickly community term. Reach some benefit military."
