event_id,event_name,performer,event_date,venue_id,organizer_id,status,description
226,Inverse mission-critical utilization,Jason Morris,2024-11-03,16,6643,Scheduled,Position she share as program and. Hour watch table once produce after.
227,Business-focused solution-oriented hub,Tami Norris,2024-01-27,10,6631,Canceled,Country student compare population. However finally same health politics.
228,Mandatory homogeneous info-mediaries,William Adams,2024-11-21,9,19326,Scheduled,Last environmental direction these call your happen. Issue bank decade far character scene. What why third entire theory reveal term. Everyone national beautiful reality open parent reason.
229,Centralized foreground moderator,Brian Carlson,2024-02-27,7,12366,Scheduled,Mention statement save manager example explain month. Organization chance buy job Mrs according by. Big continue reason positive piece upon home.
230,Persevering demand-driven project,Katherine White DDS,2024-10-27,6,9442,Scheduled,Share positive animal organization west religious. People picture toward any. Society animal identify mission degree else source.
231,Ergonomic homogeneous Local Area Network,Samuel Robinson,2024-02-26,16,11299,Scheduled,"Individual sport why music. Health note group building such lose ball.
Food glass movement development recognize Republican."
232,Advanced background intranet,Monica Watts,2024-06-30,12,13467,Scheduled,"Name once put get.
Entire financial represent tend along. Lose wait as end door. Fact continue though standard paper fast. Rock trouble need magazine."
233,Intuitive next generation help-desk,Erika Monroe,2024-07-28,4,3808,Scheduled,"Land rest give skin lay suffer policy. People easy picture enter both.
Give help ever a leader rock. Behind travel several where from."
234,Configurable bi-directional software,Shannon Martin,2024-04-06,19,847,Scheduled,Vote strategy physical theory. Week here close American try base build discussion. Seek strategy one why country almost.
235,Reduced 3rdgeneration Graphical User Interface,Katherine Nixon,2024-04-03,1,12157,Scheduled,"Rest each study week rather. Gun production money sell phone. Though perhaps board my situation them.
Long because take general like leave responsibility. Better team within."
236,Mandatory mission-critical matrices,Daniel Perez,2024-08-25,5,4816,Scheduled,Everything consumer movement recognize use industry cover. Field industry power yes feeling force prove friend. Meeting policy whose forward.
237,User-centric bandwidth-monitored analyzer,Kari Rice,2024-09-04,15,13899,Completed,Reality still agreement onto five cup certain doctor. Create goal everything.
238,Grass-roots methodical infrastructure,Samantha Hart,2024-10-24,18,15248,Canceled,"Along throughout boy school tonight manager site. Sort station sign Congress. Me probably say know effect radio.
Think town far woman reduce wait subject. Seven that also whole oil."
239,Networked fault-tolerant migration,Nancy Williams,2024-05-07,2,1779,Scheduled,"See happen idea stuff debate how attorney.
Majority all American already. Now stand seat though firm.
Call lose hand particularly more. Room push owner employee degree tough."
240,Polarized contextually-based system engine,Sarah Howard,2024-09-08,1,13468,Scheduled,Region themselves inside unit building who. View marriage hand score its. Hope project project always cut spend party Republican.
241,Customer-focused bottom-line orchestration,Jeffrey Faulkner,2024-10-28,15,14159,Completed,"Various occur true. Television school remember western well him decade head.
Especially require peace conference man nation. Maintain lot book fear.
Late home manager break."
242,Advanced logistical product,Jenna Park,2024-01-22,12,5940,Completed,"Produce space drop simply. Success and hour set argue economic soon audience. Kind fund term into feel edge. Stay item high best manager.
Church within west statement education. Stage factor so."
243,De-engineered secondary emulation,Sean West,2024-09-03,1,19376,Scheduled,"Life debate nature. Leader computer each ahead think reach science. Camera with tell it fast.
Line rest item billion budget.
Fast sing who page could of item. Know section small him total nor."
244,Decentralized grid-enabled installation,James Blankenship,2024-08-25,8,14139,Scheduled,Pass time model option resource within great. Hit front beautiful war. Power manage yourself. Mind fine home court ok despite ability themselves.
245,Multi-layered fresh-thinking website,Kenneth Aguirre,2024-06-21,4,19283,Canceled,"Anyone grow past forward writer none. Sport city its each push. We different cup poor table actually.
Government make not floor. Picture personal statement building expert interesting now."
246,Reactive global superstructure,Gerald Ramos,2024-08-30,1,12367,Scheduled,Clearly six common seven sense. Clearly whole information crime. Few father girl anyone.
247,Profound system-worthy throughput,Ronald Craig,2024-11-09,8,8618,Scheduled,"Us writer plant population.
Room with left enter indeed number discover often. Yes ahead team against."
248,Future-proofed dynamic Graphic Interface,Christopher Brown,2024-02-20,7,19583,Scheduled,"Author century letter their. Morning friend arrive enough wind behavior. Who everything structure card.
Nation race yard from body would article."
249,Team-oriented stable functionalities,Anna Graves,2024-02-18,19,8879,Scheduled,Avoid score statement citizen. Great important involve manager bed sure.
250,Implemented responsive forecast,Joshua Brown,2024-06-19,20,12100,Scheduled,"Interesting leader cost. Issue another without.
Million sometimes positive customer. Organization where painting ground fact they. Road practice might well plan they."
251,Virtual maximized contingency,Patricia Gibson,2024-12-01,12,8889,Scheduled,"Class still political everything. Nice policy that. Name suffer whatever pull.
Likely people them prevent election trip. Keep student page experience."
252,Grass-roots asymmetric instruction set,Diana Collins,2024-02-09,1,5299,Scheduled,"Increase use compare activity but. Reflect doctor movie answer power piece.
Answer time smile back. Gun dog bag. Political design region bring which alone."
253,Multi-layered composite infrastructure,Jessica Davis,2024-01-21,12,18740,Canceled,"Exist bit computer various western. Despite lawyer us spend.
Show rate character enjoy father kind may.
Participant visit job begin. Herself remember short social out certain."
254,User-centric motivating knowledge user,Marcus Frank,2024-03-18,14,3586,Scheduled,"Station body everybody finish free.
Technology receive production art. Anyone effort research skill site measure health.
Tend keep tell much region south. Woman wait image health office raise."
255,Robust explicit contingency,Jessica Goodman,2024-08-27,10,8764,Scheduled,"Him opportunity yard single simply avoid. Democrat option she happy heart later coach.
Throughout hear true good less and figure. Difference long face meeting your seek."
256,Re-engineered interactive forecast,Stacey Hardy,2024-04-24,14,14174,Scheduled,"As lay though many return. Inside only analysis evidence late return.
Tell lead wait fire sense wonder night. Concern think role doctor."
257,Synergistic incremental complexity,Stephanie Moore,2024-07-15,10,15584,Completed,Those including professional well. Purpose better increase improve husband data. Movement book want much.
258,Compatible holistic matrix,Kathleen Martinez,2024-05-16,20,14540,Scheduled,"Leader fear policy. Environment build style report not.
Worker finish cover stuff. Sing site well who everything yard.
During agency smile."
259,Ameliorated directional migration,Christopher Dominguez,2024-04-16,10,14843,Completed,"Season recent force seem loss present. Republican much air billion attack.
First need behavior guess forward site move company. By agreement despite light skin baby discussion into."
260,Synergistic tertiary knowledge user,Sarah Estrada,2024-10-07,4,16778,Canceled,Whose approach population key serve ago mission. Expert news strategy take measure.
261,Horizontal zero administration superstructure,Shannon Esparza,2024-02-12,7,128,Canceled,"Course per ten consumer. Reveal large news out election. Minute else man employee.
Cup ask point guy song law evidence. Between American always upon son relate room candidate."
262,Enhanced bandwidth-monitored moderator,Michelle Weaver,2024-04-15,14,14267,Completed,"Traditional kid suggest although. During forward painting something own year face father. Beautiful environment produce town.
Card fall degree relationship lot."
263,Profit-focused content-based alliance,Timothy Meyer,2024-10-22,1,6352,Scheduled,"Thus democratic small painting interest somebody eat environment.
Century its occur eat rest. Speak seek official buy economic."
264,Advanced solution-oriented process improvement,Jenna Rice,2024-02-07,12,16041,Scheduled,"Risk feel according bank fight tree. Store commercial per they. Movie result brother next.
Test really clear seem popular account."
265,Fundamental demand-driven hierarchy,Andrew Bruce,2024-03-04,20,8441,Scheduled,Such be want despite style. Second involve probably image military food lead. Learn minute father drug senior.
266,Future-proofed didactic neural-net,Chelsey Watson,2024-06-08,11,5554,Completed,"Man could especially huge technology mention visit. Property blood news. Sport not court.
Individual forget consider court exist year go. Condition safe responsibility especially."
267,Customizable fault-tolerant collaboration,Jason Murray,2024-04-28,14,17313,Scheduled,Yourself least experience down. Evidence dark course market performance score heavy. Three avoid by court fish year.
268,Customer-focused holistic process improvement,Debra Davenport,2024-05-09,11,4453,Completed,Run time about central. Congress stuff century wrong. Model check suddenly benefit series interesting.
269,Programmable value-added emulation,William Patel,2024-03-01,1,6448,Scheduled,"View bit manager religious current million. Try factor order garden. Affect our usually raise green his woman.
General brother mother which leg floor. Memory by itself speech box particular later."
270,Sharable directional analyzer,Natasha Powell,2024-01-21,2,11992,Scheduled,Appear partner stop tax agent owner system. Film others under chair especially dinner war. Environmental cut dog want no car organization.
271,Reduced exuding complexity,Robert Carroll,2024-03-18,16,16866,Scheduled,"Rather cup choose buy. American strategy nearly husband rise.
Way figure make pretty fear industry later. Final travel course hot."
272,Enterprise-wide cohesive capacity,Eric Roman,2024-07-28,19,1029,Scheduled,"Prove current enjoy sign. Up focus suggest. Feel sing attack tonight citizen seven.
North at interesting thought. Ever third parent cost among certain technology. Pattern foot level."
273,Cloned explicit monitoring,Charles Nichols,2024-07-26,12,4724,Canceled,"Home into difference trial. Drop than mother film commercial. Goal fast ok provide college institution main.
Court agent itself analysis manage. Treatment report wonder figure example seven."
274,Down-sized clear-thinking middleware,Shaun Branch,2024-05-30,14,3855,Canceled,Teacher computer section require strong unit sound. South gas campaign personal oil pick receive. Most affect push control.
275,Innovative actuating structure,Nicholas Johnson,2024-06-23,14,14681,Completed,School candidate plant piece reflect check information discuss. Say gas real bill travel tell. Work three word concern.
276,Multi-lateral non-volatile capability,William Logan,2024-03-25,20,8672,Scheduled,"Heavy child week us it series worry. Fund go today glass single establish just shoulder.
Collection plan population score into them. Race front threat floor both will because."
277,Balanced mobile monitoring,Leslie Larson,2024-03-21,13,771,Scheduled,Care big new realize. Amount character onto adult bit. Focus open force without technology. Require case understand office section vote management.
278,Organic intangible methodology,Ian Simpson,2024-02-07,14,8659,Canceled,Design film none support effect such. Give price western then price section once dream. Director season machine.
279,Self-enabling didactic customer loyalty,Jessica Sutton,2024-06-27,5,6670,Scheduled,"Teach one choice teach. Teacher TV specific medical level ago. Role picture PM history.
Personal again able condition. Herself fear such finish method many."
280,Digitized multi-tasking encoding,William Lozano,2024-05-14,3,11141,Scheduled,"Those so reality church window woman hundred. Social blood major evening organization. Result its life pay power.
Although mouth get knowledge long race. Bar moment owner company then exist product."
281,Multi-layered even-keeled pricing structure,Derrick Martin,2024-08-25,9,2103,Scheduled,"Guess fund policy they. Cell theory effect sister activity.
Official financial relationship health open miss sell knowledge. American pattern tough statement."
282,Quality-focused mobile focus group,William Gray,2024-07-11,16,8477,Scheduled,"Weight serve who parent. Billion cost despite development loss. Wide even war kind quickly.
Subject Mr war. Forget upon protect town. Those institution itself event nation education travel."
283,Cross-group exuding success,Joel Shepherd,2024-11-08,13,17407,Scheduled,"Threat certain reveal west who total. Should though trial property knowledge thus.
Surface nice opportunity stand."
284,Reactive zero-defect Graphic Interface,Amy Kennedy,2024-04-24,15,5789,Scheduled,Per risk grow debate conference public walk modern. Himself billion get what weight stand image if. It enough American budget face federal measure. Company police his allow station.
285,Stand-alone intangible open system,Charles Taylor,2024-02-09,12,19446,Scheduled,School carry here case table would commercial. Project environmental little very build behavior make dinner. Such policy walk.
286,User-friendly demand-driven product,Jacob Jones,2024-12-02,7,18844,Canceled,"Field such receive health. Thousand the claim.
Off ten phone go agree person ball network. Quickly set girl material up."
287,Future-proofed content-based functionalities,Jasmine Reid,2024-12-05,16,6344,Completed,Through ability blue while knowledge concern. Significant hospital human civil expert red water. On protect doctor travel cost choice far.
288,Right-sized secondary instruction set,Kimberly West,2024-08-03,17,2969,Completed,"Budget worker general analysis everyone identify.
Attention nearly go partner administration. Painting amount either some laugh analysis quality."
289,Triple-buffered interactive migration,Caroline Black DDS,2024-05-23,19,11367,Scheduled,"Beyond though glass particular. Education reflect yes provide small play car.
Ago discuss particularly eye. I cover character town lose daughter. Just hit hand state."
290,Face-to-face client-driven challenge,Ryan Alvarez,2024-05-09,4,5925,Scheduled,"Common skill next research information represent movement.
Official go produce provide admit walk want particularly. Usually behind through available thank product. Well however whose song."
291,Realigned background hub,Christopher Woodard,2024-04-10,5,2282,Scheduled,"Stock probably rule for. Out hour anything hope check. Win choice national control.
Collection law build media. Woman response section thousand seek far. Hard issue activity film me wind condition."
292,Vision-oriented logistical customer loyalty,James Parker,2024-01-19,20,15634,Scheduled,"Space political help glass goal. Box religious leader executive present movement. Station bill system campaign cover.
Computer score language many back positive certain. Cost between long decision."
293,Exclusive 6thgeneration moderator,April Robbins,2024-06-16,14,4964,Scheduled,"Development high claim themselves. Everyone whom represent professor child.
White personal prepare simply ok itself view. Act over add. Bag fight hundred.
Thousand carry make case strategy trouble."
294,Assimilated didactic knowledgebase,Michael Jones,2024-11-06,18,18172,Scheduled,Area five because sister. Few sure democratic conference become offer. Arrive movie account key race.
295,Networked zero tolerance encoding,Alyssa Graves PhD,2024-11-01,19,3342,Scheduled,With food goal season practice. Over either then life she site. Job rest run member. Forward safe one person hold do expert.
296,Ameliorated mobile data-warehouse,Amy Pennington,2024-03-02,20,1062,Completed,"High yard subject onto voice research support.
Company fill no product hard. Memory enter resource act bank figure relate. Later hope base American."
297,Mandatory optimal artificial intelligence,James Boone,2024-07-07,16,10111,Scheduled,Garden clearly use yeah indicate. Require stop however him whatever accept. Into road road door plan factor action.
298,Re-contextualized coherent protocol,Melanie Willis DDS,2024-05-04,17,16349,Completed,Per person choose six space network. Ball themselves movie. Power remember experience place hard score.
299,Extended explicit conglomeration,Terry Pollard,2024-10-21,12,12878,Completed,Doctor former animal. Join more science daughter. Lot key capital degree beautiful.
300,Proactive grid-enabled open architecture,Stephanie Tran,2024-09-20,1,5867,Scheduled,"Type film soon back nearly.
Cold once purpose.
Who campaign care personal season. Usually take appear people card east any. Enter future rate strong. Huge traditional hair visit."
